<?xml version="1.0" encoding="UTF-8"?>
<!--Sample XML file generated by XMLSpy v2017 sp2 (http://www.altova.com)-->
<ERPToNeoPLMMaterialTypeMaps xmlns:xsi="http://www.w3.org/2001/XMLSchema-instance" xsi:noNamespaceSchemaLocation="ERPToNeoPLMMaterialTypeMaps.xsd">
	<ERPToNeoPLMMaterialTypeMap>
		<SourceSystemID>Europe2</SourceSystemID>
		<PlantID>BEP7</PlantID>
		<ERPMaterialType>IM</ERPMaterialType>
		<NeoPLMMaterialType>Consumable</NeoPLMMaterialType>
	</ERPToNeoPLMMaterialTypeMap>
	<ERPToNeoPLMMaterialTypeMap>
		<SourceSystemID>Europe2</SourceSystemID>
		<PlantID>BEP7</PlantID>
		<ERPMaterialType>TEMA</ERPMaterialType>
		<NeoPLMMaterialType>Consumable</NeoPLMMaterialType>
	</ERPToNeoPLMMaterialTypeMap>
		<ERPToNeoPLMMaterialTypeMap>
		<SourceSystemID>Europe2</SourceSystemID>
		<PlantID>BEP7</PlantID>
		<ERPMaterialType>ZMH</ERPMaterialType>
		<NeoPLMMaterialType>Consumable</NeoPLMMaterialType>
	</ERPToNeoPLMMaterialTypeMap>
	<ERPToNeoPLMMaterialTypeMap>
		<SourceSystemID>Europe2</SourceSystemID>
		<PlantID>BEP7</PlantID>
		<ERPMaterialType>ZMBW</ERPMaterialType>
		<NeoPLMMaterialType>Consumable</NeoPLMMaterialType>
	</ERPToNeoPLMMaterialTypeMap>
		<ERPToNeoPLMMaterialTypeMap>
		<SourceSystemID>Europe2</SourceSystemID>
		<PlantID>BEP9</PlantID>
		<ERPMaterialType>IM</ERPMaterialType>
		<NeoPLMMaterialType>Consumable</NeoPLMMaterialType>
	</ERPToNeoPLMMaterialTypeMap>
	<ERPToNeoPLMMaterialTypeMap>
		<SourceSystemID>Europe2</SourceSystemID>
		<PlantID>BEP9</PlantID>
		<ERPMaterialType>TEMA</ERPMaterialType>
		<NeoPLMMaterialType>Consumable</NeoPLMMaterialType>
	</ERPToNeoPLMMaterialTypeMap>
		<ERPToNeoPLMMaterialTypeMap>
		<SourceSystemID>Europe2</SourceSystemID>
		<PlantID>BEP9</PlantID>
		<ERPMaterialType>ZMH</ERPMaterialType>
		<NeoPLMMaterialType>Consumable</NeoPLMMaterialType>
	</ERPToNeoPLMMaterialTypeMap>
	<ERPToNeoPLMMaterialTypeMap>
		<SourceSystemID>Europe2</SourceSystemID>
		<PlantID>BEP9</PlantID>
		<ERPMaterialType>ZMBW</ERPMaterialType>
		<NeoPLMMaterialType>Consumable</NeoPLMMaterialType>
	</ERPToNeoPLMMaterialTypeMap>
</ERPToNeoPLMMaterialTypeMaps>